<?xml version="1.0" encoding="UTF-8" ?>
<discountCard ID="12312312"
              xmlns:xsi="http://www.w3.org/2001/XMLSchema-instance"
              xsi:noNamespaceSchemaLocation="discountCardExample.xsd">
    <person>
        <lastName>Ivanov</lastName>
        <firstName>Ivan</firstName>
        <sex>male</sex>
        <age>18</age>
    </person>
    <dateOfRegistry>27.10.2022</dateOfRegistry>
    <cardStatusType>gold</cardStatusType>
    <phoneNumber>+375(29)2020327</phoneNumber>
    <address>
        <country>Belarus</country>
        <city>Minsk</city>
        <street>Timiryazeva</street>
        <zip>220000</zip>
    </address>
    <email>ivanov.iv@gmail.com</email>
</discountCard>